{
  "model_id": "mldp_pruned_permission",
  "split": "val",
  "alignment_key": "sha256",
  "canonical_manifest": "/mnt/Files/thesis_vigidroid/Shared_pipeline_Files/data/splits/canonical_val.txt",
  "n_samples": 764,
  "n_aligned": 764,
  "threshold": 0.1,
  "metrics": {
    "accuracy": 0.9410994764397905,
    "f1": 0.9036402569593148,
    "roc_auc": 0.9223869296672644
  },
  "rows": [
    {
      "apk_id": "08ba3ee17b0c08e19fb0c45c1f07f7378031b5b0b299818d02a1e12213db90cf",
      "label": 0,
      "score": 0.028392361477017403
    },
    {
      "apk_id": "b98d0446e5218522662ba672b91f06ae4a4d3dcfa46bba013d4421cbd1f5603c",
      "label": 1,
      "score": 0.7348019480705261
    },
    {
      "apk_id": "7d5d6edde48290a58d4a5857ebbe1d9f3e88d2982a68cdf71e5b564bfd9b7777",
      "label": 0,
      "score": 0.028392361477017403
    },
    {
      "apk_id": "eafa7795e0158f9fb9b66cc92bbf6ee5509232d66743d289ca00f866ea5fac08",
      "label": 0,
      "score": 0.028392361477017403
    },
    {
      "apk_id": "2a017e6d55ddfa7cf9ed13051102e1d047844d8b9de3ae0de52ce88797205d6d",
      "label": 1,
      "score": 0.3177885115146637
    },
    {
      "apk_id": "0caa5e72f3d48fbea5af76e99af711ce221d4ce298e2e015449efaf6bea84127",
      "label": 1,
      "score": 0.9999948740005493
    },
    {
      "apk_id": "20a81bf6fa59673f72b9f1e7632acce268d482c2977f4b7934b77570ec824775",
      "label": 0,
      "score": 0.10560649633407593
    },
    {
      "apk_id": "b39f34fec98c707e8e3f7655415f9de849f593b9017a82ed8d4c90e36a327f20",
      "label": 1,
      "score": 1.0
    },
    {
      "apk_id": "89d99be42dfe4f8eefed5b3270756949cddd34b1b7e88a3d4c3538a011eb48ed",
      "label": 1,
      "score": 0.16976754367351532
    },
    {
      "apk_id": "932bb40c8f948028e14a2f97a5e4d1ff1ab5cf056acfdd0c3190920d88553b17",
      "label": 0,
      "score": 0.028392361477017403
    },
    {
      "apk_id": "3464672011d8ac25a66efad70f09939267a54f5007dec86ee60563ad5bc80ef1",
      "label": 1,
      "score": 1.0
    },
    {
      "apk_id": "1f27302f01262dc9641912871907719829735b6e8bb0bb5a87530c3e4eb20645",
      "label": 1,
      "score": 0.011009245179593563
    },
    {
      "apk_id": "de510f2233d3cbe76a0e77e6a024a0f4efd9291af542563c2aadb9530bcaa46d",
      "label": 0,
      "score": 0.028392361477017403
    },
    {
      "apk_id": "601d025c7c7fea180652460b08e59accb68c4955d25ff14a76fac31043b94ca5",
      "label": 0,
      "score": 0.028392361477017403
    },
    {
      "apk_id": "4b55fb19f62b8177281933d8d4a8d91d6f9fd908d38d7f97a1511ef72cd70172",
      "label": 0,
      "score": 0.028392361477017403
    },
    {
      "apk_id": "294112577ca53ef4dff028563da20c242287394898c18b4f58bf2116de461be3",
      "label": 1,
      "score": 0.9995959401130676
    },
    {
      "apk_id": "79a43be4dc906091e92f6b8e1722bc7c01190fcb9aca3bfe5d6191517ff28afa",
      "label": 1,
      "score": 0.9999490976333618
    },
    {
      "apk_id": "7544e86c5128ceff85bb32cca724877c6e515362b54c8b8622b97167a5132266",
      "label": 0,
      "score": 0.05936560034751892
    },
    {
      "apk_id": "e28433dc96a7d214b6b6eccd99622e42b6a0cd0ec3cf2588404c0182533c8867",
      "label": 1,
      "score": 0.9997221827507019
    },
    {
      "apk_id": "5c2fb1b7c1ab9f235bf6a5137bf25eb609c4c1a850906d14e1e905d02cc384f8",
      "label": 0,
      "score": 0.028392361477017403
    },
    {
      "apk_id": "6f36cb477a98fde6c597f74eaf67d6724dbefc7826470fa1cd64c6934d220419",
      "label": 0,
      "score": 0.028392361477017403
    },
    {
      "apk_id": "4546614ae970cda3605497c8c2b3c82aa7b3e28c1eb18c1a9ff93324e6a9f29a",
      "label": 0,
      "score": 0.6867635846138
    },
    {
      "apk_id": "370ecfd5de37663e031d271d81d7f8cf49fd2366e1289c25ddeff0f5806fe2d7",
      "label": 0,
      "score": 0.028392361477017403
    },
    {
      "apk_id": "57e6df632f2c788de06864d588b0c7e0df0f9db6a04047a54709b0691e9d916a",
      "label": 1,
      "score": 0.028392361477017403
    },
    {
      "apk_id": "a01429206d04b71527c04bc87d3eaf68fe9577fdca3ba88cdb44ea634855f315",
      "label": 0,
      "score": 0.028392361477017403
    },
    {
      "apk_id": "69a6b82ca4d610fb03d94595b654f423c59bb84b0b7a4c0335fd3a3332f55922",
      "label": 0,
      "score": 0.028392361477017403
    },
    {
      "apk_id": "12739abd5582cb3eb22b74aa96968ae316f867c93b6e60089280a79729fd5ad3",
      "label": 0,
      "score": 0.028392361477017403
    },
    {
      "apk_id": "c20e1ad3e591c87539cc58dace12cd19bc4ac26c35c799d2e45653212ad67b7a",
      "label": 0,
      "score": 0.028392361477017403
    },
    {
      "apk_id": "faeb88bd9a9e6f222b3d57f3f57c7d6704a700250374f905f738ae563cd71a3c",
      "label": 1,
      "score": 0.9999597072601318
    },
    {
      "apk_id": "e2e6f73033c3f49c3f2b2b4ac05ee930e7f22640cc77bfe1544bf686a221d138",
      "label": 0,
      "score": 0.028392361477017403
    },
    {
      "apk_id": "7b2514fed55284e4d3175d2e92ea2d238e844fbbe9f63d35b9958c9ad5ab3cb4",
      "label": 0,
      "score": 0.06135469302535057
    },
    {
      "apk_id": "c11a6cd7b2a295498585547303c8aefd0a94152c04cf32f2ad5fa8b94bb9ed27",
      "label": 1,
      "score": 0.9999885559082031
    },
    {
      "apk_id": "ea92a1d6384b3e1ceb5f57bf282157336878397d4d7b6d0f49851425d430adb4",
      "label": 0,
      "score": 0.05936560034751892
    },
    {
      "apk_id": "fdd425edc99338727aa903929c4a618a277e30dbff41f727c1fb1fe524a346eb",
      "label": 0,
      "score": 0.028392361477017403
    },
    {
      "apk_id": "d8ef3dae8ba03b19669688100c4a67938e2d7b5427d8d66cd2d6bf6af8ed1655",
      "label": 0,
      "score": 0.028392361477017403
    },
    {
      "apk_id": "a03b4bf66e66922254119ca15e057847e1c811cc6bfa99c6c848d07293994f9a",
      "label": 0,
      "score": 0.028392361477017403
    },
    {
      "apk_id": "2c67cec9934982ea229122eea397818b869e63359856dff1a297ba28f4f133cd",
      "label": 1,
      "score": 0.5725287199020386
    },
    {
      "apk_id": "441ddb72e9b6c1e09e893ca7b4aa4565d2169c049d71e444c04af1cc5b04d4f7",
      "label": 0,
      "score": 0.4539850056171417
    },
    {
      "apk_id": "a6611b70c5d4dc4507ccc19dd90c96c65ff6f56ef7ffeba089cbe2868c71cafc",
      "label": 0,
      "score": 0.028392361477017403
    },
    {
      "apk_id": "a3fe01ed9f5a977e0f61ea59565f01195476d27e13689fca70859cf8ef1579f0",
      "label": 0,
      "score": 0.028392361477017403
    },
    {
      "apk_id": "a6da7ac40e1241ec7bb6fa71c2183145edb264fbfc13ca865e9c7397d4cc5c1c",
      "label": 0,
      "score": 0.07991601526737213
    },
    {
      "apk_id": "b9d1cca90ad3d2d3c6eba396326d91617ab2c60dbfeaf78e59c0850886aa0f15",
      "label": 1,
      "score": 0.8205059766769409
    },
    {
      "apk_id": "dc9bf4d7e90f7b76de911ff5552e962bb486fbc035ee93170330da86c8747acf",
      "label": 1,
      "score": 0.9999357461929321
    },
    {
      "apk_id": "e9b9f38f18a4af36479e9835eecebbb463b10f49641f39bc501d9d3650164a2b",
      "label": 0,
      "score": 0.028392361477017403
    },
    {
      "apk_id": "b2ae8732cbb0169e3dd3058d1efba1d840ee9909817dbee5b855a453ad825b0d",
      "label": 0,
      "score": 0.028392361477017403
    },
    {
      "apk_id": "313c15c3dc2715cc0d3152e47978ac18934c20b35baf7369ddac9ec8a64d6fcb",
      "label": 0,
      "score": 0.028392361477017403
    },
    {
      "apk_id": "7c0016748a0a1655ca69a46bcbd7354cdce5a3dd0b8473ff175a649b8bd53714",
      "label": 1,
      "score": 0.2704143226146698
    },
    {
      "apk_id": "a54fd260417a50167fbb20732a43c24851fbef85cec6dd4a513ba29025590293",
      "label": 0,
      "score": 0.028392361477017403
    },
    {
      "apk_id": "89936babf24921db7caf9bbec41b88894c7d3b35e75eb31680b0592afe6d6d84",
      "label": 0,
      "score": 0.028392361477017403
    },
    {
      "apk_id": "016248168f7200e26095d8b28613f82a79f3a5939575b9cb1975400ce32a9a23",
      "label": 0,
      "score": 0.028392361477017403
    },
    {
      "apk_id": "1ae9a63979e45e95d5bce4eac1a057c8a9b5df14435cd27d13def48126fe5fcf",
      "label": 0,
      "score": 0.028392361477017403
    },
    {
      "apk_id": "20fc28a49e2b6ccbbb2ea6df3d525f63e4261833b61cec4ee134793778516f04",
      "label": 1,
      "score": 0.9999997615814209
    },
    {
      "apk_id": "9a5ff0e5c89845000a961c2a67a56a3816bc8a0f4c1aa14592c8dfcbe8ae4715",
      "label": 1,
      "score": 1.0
    },
    {
      "apk_id": "fa14442ea88edaedf4bc960427d552710ef69ac81b581f6481283e4406041299",
      "label": 0,
      "score": 0.028392361477017403
    },
    {
      "apk_id": "e8787718b197e8679d3a105692bee6d5bf9c4d861dfc65e0b3d079ca81fda155",
      "label": 1,
      "score": 1.0
    },
    {
      "apk_id": "82debae1674d97ba4e300e987477393ca5734e1870b89400ec142c5e79bbdb0f",
      "label": 0,
      "score": 0.028392361477017403
    },
    {
      "apk_id": "b819504f86c6a5b1c9e4468176ce3df77de7bb59f7ff5023d5ce976308f82e56",
      "label": 0,
      "score": 0.028392361477017403
    },
    {
      "apk_id": "e793f7afc68f36a08499bdf6b8a7cb78413bb7ca2a6596567cdd571c54f1c803",
      "label": 0,
      "score": 0.05936560034751892
    },
    {
      "apk_id": "ce8bdd1c49f6461f2bb20aafe5b64c38c228269ebd1b976d9bdba07ed3f5af7d",
      "label": 0,
      "score": 0.028392361477017403
    },
    {
      "apk_id": "0daf712f0b1d47cf7e35ccba3be5da83a7151952f285d990ad033d7438cdaf16",
      "label": 0,
      "score": 0.71808922290802
    },
    {
      "apk_id": "b4f5317e158320f089a7dfa8a6036e64a44e3575dbda4b6513c9a98373134422",
      "label": 0,
      "score": 0.028392361477017403
    },
    {
      "apk_id": "5c6f0c5debea4a475b0001f5df474fe5528ecc92f026d5e44ee4b90e83c43891",
      "label": 0,
      "score": 0.028392361477017403
    },
    {
      "apk_id": "856511ad02d7c511b073b108bfb973cea0adb167821983360334cc8be20bbf74",
      "label": 1,
      "score": 1.0
    },
    {
      "apk_id": "1a13e96133ed275074221be94356710606a4cecb8d55597a53b20ccee4c3d20d",
      "label": 0,
      "score": 0.028392361477017403
    },
    {